{
  "format": "deathstalker-godot-presentation-bridge",
  "schemaVersion": 1,
  "source": {
    "authoritativeRuntime": "typescript-core",
    "generator": "scripts/export-godot-presentation.ts",
    "fixtureId": "phase-1-empire-skirmish",
    "seed": 230823
  },
  "encounter": {
    "id": "enc_empire_skirmish",
    "name": "Imperial Perimeter Patrol",
    "tier": "skirmish",
    "environment": {
      "type": "unconfigured",
      "lightSourceX": 0.5,
      "lightSourceY": 0.2,
      "lightColor": "#ffe080",
      "floorTint": "#202530",
      "hazeColor": "#25354a",
      "stoneColor": "#343948",
      "metalColor": "#252c3a",
      "shadowColor": "#080c14",
      "accentColor": "#63e6ff"
    }
  },
  "timing": {
    "frameStepSeconds": 1.15,
    "endHoldSeconds": 2.5,
    "durationSeconds": 30.1
  },
  "frames": [
    {
      "index": 0,
      "atSeconds": 0,
      "action": null,
      "state": {
        "encounterId": "enc_empire_skirmish",
        "battleMode": "legacy",
        "turnNumber": 1,
        "activeActorId": "crew_kaelen",
        "status": "in_progress",
        "inventory": {
          "medkits": 4,
          "revives": 1
        },
        "combatants": [
          {
            "id": "crew_valen",
            "displayName": "Valen Vance",
            "side": "party",
            "faction": "party",
            "role": "Captain / Striker",
            "slot": 0,
            "hp": 120,
            "maxHp": 120,
            "esp": 0,
            "maxEsp": 0,
            "alive": true,
            "accentColor": "#38bdf8",
            "isBoosting": false,
            "burnout": 0,
            "crashTurns": 0,
            "hasForceShield": false,
            "stunnedTurns": 0,
            "disruptor": {
              "ready": false,
              "cooldownTurns": 3
            },
            "range": {
              "band": null,
              "targetId": null
            }
          },
          {
            "id": "crew_lyra",
            "displayName": "Lyra Chen",
            "side": "party",
            "faction": "party",
            "role": "Sole Esper",
            "slot": 1,
            "hp": 85,
            "maxHp": 85,
            "esp": 80,
            "maxEsp": 80,
            "alive": true,
            "accentColor": "#c084fc",
            "isBoosting": false,
            "burnout": 0,
            "crashTurns": 0,
            "hasForceShield": false,
            "stunnedTurns": 0,
            "disruptor": {
              "ready": false,
              "cooldownTurns": 3
            },
            "range": {
              "band": null,
              "targetId": null
            }
          },
          {
            "id": "crew_kaelen",
            "displayName": "Kaelen Voss",
            "side": "party",
            "faction": "party",
            "role": "Mercenary Striker",
            "slot": 2,
            "hp": 90,
            "maxHp": 90,
            "esp": 0,
            "maxEsp": 0,
            "alive": true,
            "accentColor": "#fb923c",
            "isBoosting": false,
            "burnout": 0,
            "crashTurns": 0,
            "hasForceShield": false,
            "stunnedTurns": 0,
            "disruptor": {
              "ready": false,
              "cooldownTurns": 3
            },
            "range": {
              "band": null,
              "targetId": null
            }
          },
          {
            "id": "crew_tarek",
            "displayName": "Tarek 'Sprocket'",
            "side": "party",
            "faction": "party",
            "role": "Heavy Tech Marine",
            "slot": 3,
            "hp": 140,
            "maxHp": 140,
            "esp": 0,
            "maxEsp": 0,
            "alive": true,
            "accentColor": "#4ade80",
            "isBoosting": false,
            "burnout": 0,
            "crashTurns": 0,
            "hasForceShield": false,
            "stunnedTurns": 0,
            "disruptor": {
              "ready": false,
              "cooldownTurns": 3
            },
            "range": {
              "band": null,
              "targetId": null
            }
          },
          {
            "id": "emp_legionnaire_1",
            "displayName": "Imperial Legionnaire A",
            "side": "enemy",
            "faction": "empire",
            "role": "Standard Line Infantry",
            "slot": 0,
            "hp": 185,
            "maxHp": 185,
            "esp": 0,
            "maxEsp": 0,
            "alive": true,
            "accentColor": "#f43f5e",
            "isBoosting": false,
            "burnout": 0,
            "crashTurns": 0,
            "hasForceShield": false,
            "stunnedTurns": 0,
            "disruptor": {
              "ready": false,
              "cooldownTurns": 3
            },
            "range": {
              "band": null,
              "targetId": null
            }
          },
          {
            "id": "emp_legionnaire_2",
            "displayName": "Imperial Legionnaire B",
            "side": "enemy",
            "faction": "empire",
            "role": "Standard Line Infantry",
            "slot": 1,
            "hp": 185,
            "maxHp": 185,
            "esp": 0,
            "maxEsp": 0,
            "alive": true,
            "accentColor": "#fb7185",
            "isBoosting": false,
            "burnout": 0,
            "crashTurns": 0,
            "hasForceShield": false,
            "stunnedTurns": 0,
            "disruptor": {
              "ready": false,
              "cooldownTurns": 3
            },
            "range": {
              "band": null,
              "targetId": null
            }
          }
        ],
        "turnQueue": [
          {
            "order": 0,
            "actorId": "crew_kaelen",
            "predictedTick": 1
          },
          {
            "order": 1,
            "actorId": "crew_lyra",
            "predictedTick": 1
          },
          {
            "order": 2,
            "actorId": "crew_valen",
            "predictedTick": 2
          },
          {
            "order": 3,
            "actorId": "emp_legionnaire_1",
            "predictedTick": 2
          },
          {
            "order": 4,
            "actorId": "emp_legionnaire_2",
            "predictedTick": 2
          },
          {
            "order": 5,
            "actorId": "crew_tarek",
            "predictedTick": 3
          },
          {
            "order": 6,
            "actorId": "crew_kaelen",
            "predictedTick": 6
          },
          {
            "order": 7,
            "actorId": "crew_lyra",
            "predictedTick": 7
          },
          {
            "order": 8,
            "actorId": "crew_valen",
            "predictedTick": 8
          },
          {
            "order": 9,
            "actorId": "emp_legionnaire_1",
            "predictedTick": 8
          }
        ],
        "events": []
      }
    },
    {
      "index": 1,
      "atSeconds": 1.15,
      "action": {
        "type": "attack",
        "actorId": "crew_kaelen",
        "targetId": "emp_legionnaire_1",
        "abilityId": "twin_daggers",
        "abilityName": "Twin Vibro-Daggers",
        "abilityCategory": "melee",
        "boostEnabled": null,
        "audioCue": "twin_vibro_daggers",
        "timing": {
          "durationSeconds": 0.2,
          "visualContactSeconds": 0.1,
          "beamStartSeconds": null
        }
      },
      "state": {
        "encounterId": "enc_empire_skirmish",
        "battleMode": "legacy",
        "turnNumber": 2,
        "activeActorId": "crew_lyra",
        "status": "in_progress",
        "inventory": {
          "medkits": 4,
          "revives": 1
        },
        "combatants": [
          {
            "id": "crew_valen",
            "displayName": "Valen Vance",
            "side": "party",
            "faction": "party",
            "role": "Captain / Striker",
            "slot": 0,
            "hp": 120,
            "maxHp": 120,
            "esp": 0,
            "maxEsp": 0,
            "alive": true,
            "accentColor": "#38bdf8",
            "isBoosting": false,
            "burnout": 0,
            "crashTurns": 0,
            "hasForceShield": false,
            "stunnedTurns": 0,
            "disruptor": {
              "ready": false,
              "cooldownTurns": 3
            },
            "range": {
              "band": null,
              "targetId": null
            }
          },
          {
            "id": "crew_lyra",
            "displayName": "Lyra Chen",
            "side": "party",
            "faction": "party",
            "role": "Sole Esper",
            "slot": 1,
            "hp": 85,
            "maxHp": 85,
            "esp": 80,
            "maxEsp": 80,
            "alive": true,
            "accentColor": "#c084fc",
            "isBoosting": false,
            "burnout": 0,
            "crashTurns": 0,
            "hasForceShield": false,
            "stunnedTurns": 0,
            "disruptor": {
              "ready": false,
              "cooldownTurns": 3
            },
            "range": {
              "band": null,
              "targetId": null
            }
          },
          {
            "id": "crew_kaelen",
            "displayName": "Kaelen Voss",
            "side": "party",
            "faction": "party",
            "role": "Mercenary Striker",
            "slot": 2,
            "hp": 90,
            "maxHp": 90,
            "esp": 0,
            "maxEsp": 0,
            "alive": true,
            "accentColor": "#fb923c",
            "isBoosting": false,
            "burnout": 0,
            "crashTurns": 0,
            "hasForceShield": false,
            "stunnedTurns": 0,
            "disruptor": {
              "ready": false,
              "cooldownTurns": 2
            },
            "range": {
              "band": null,
              "targetId": null
            }
          },
          {